objectid,title,filename,object_location,format,latitude,longitude,date,subject,location,description,source,language
086,Fotografia de cambio de guardias ,086.pdf,ARCHIVO/086.pdf,pdf,55.378051,-3.435973,,Guardias ,Reino Unido,El Cambio de la Guardia es el proceso en el que se releva a los guardias al cambiar de turno.,Colección de postales de Manuel Campero,Ru
087,Fotografia M.O 281,087.pdf,ARCHIVO/087.pdf,pdf,,,,Escuadron,,Se muestra al escuadron preparados ,Colección de postales de Manuel Campero,
088,"Fotografia de caballo de tambor, primeros salvavidas ",088.pdf,ARCHIVO/088.pdf,pdf,55.378051,-3.435973,,Salvavidas,Reino Unido,"El caballo del tambor tenía que ser impresionantemente alto y fuerte para llevar el peso de los tambores a través de largas procesiones. Los caballos también tenían que ser sensatos, tranquilos y bondadosos para respetar y responder voluntariamente a la dirección de rienda no tradicional utilizada. Para lograr esto, los criadores generalmente cruzaron las razas Clydesdale, Gypsy Cob y Shire. El resultado es un caballo grande, dócil y de buen carácter que hizo una aparición impresionante durante las procesiones.",Colección de postales de Manuel Campero,Ru
089,"Fotografia de entregando los colores, guardias de corriente fria ",089.pdf,ARCHIVO/089.pdf,pdf,,,,Guardias,,Guardias de corriente fria haciendo cambio de colores,Colección de postales de Manuel Campero,
090,Fotografia de individuos elegantes posando para la fotografia ,090.pdf,ARCHIVO/090.pdf,pdf,,,,Personas ,,Se muestra un grupo de personas preparados para la toma de la fotografia ,Colección de postales de Manuel Campero,
091,Retrato en pintura de Graefin Potocka,091.pdf,ARCHIVO/091.pdf,pdf,52.52437,13.41053,,Pintura retrato,"Berlín, Alemania","Pintura de un retrato con técnica pastel de Graefin Potcka, es un cuadro con relieve y con tonos claros. Pintura hecha por el pintor sueco, Anton Graff.",Colección de postales de Manuel Campero,De
092,Pintura de coronel alemán y su caballo,092.pdf,ARCHIVO/092.pdf,pdf,52.52437,13.41053,,Coronel,"Berlín, Alemania",Coronel y caballo de un batallón del ejércto alemán,Colección de postales de Manuel Campero,De
093,Pinura de soldado alemán sobre su caballo,093.pdf,ARCHIVO/093.pdf,pdf,52.52437,13.41053,,Soldado,"Berlín, Alemania",Soldado del ejército alemán con una escopeta sobre su hombro derecho con un cañón atrás.,Colección de postales de Manuel Campero,De
094,Fotografía de una calle en Bad Nauheim,094.pdf,ARCHIVO/094.pdf,pdf,50.3673,8.7394,,Ciudad,"Bad Nauheim, Alemania","Fotografía de una avenida en Bad Nauheim, Alemania",Colección de postales de Manuel Campero,De
095,Pintura de coronel alemán y su caballo,095.pdf,ARCHIVO/095.pdf,pdf,52.52437,13.41053,,Coronel,"Berlín, Alemania",Coronel y caballo de un batallón del ejércto alemán con personas atrás.,Colección de postales de Manuel Campero,De
096,Pintura de soldado alemán sobre su caballo,096.pdf,ARCHIVO/096.pdf,pdf,52.52437,13.41053,,Soldado,"Berlín, Alemania",Pintura de un soldado con su caballo y más caballo detrás en movimiento. ,Colección de postales de Manuel Campero,De
097,"Fotografía del Parián en Puebla, México",097.pdf,ARCHIVO/097.pdf,pdf,20.6388,103.3110,,Mercado,"Puebla, México","Fotografía del mercado El Parián en Puebla, México",Colección de postales de Manuel Campero,Es
098,Fotografía de un barco de vapor en Veracruz,098.pdf,ARCHIVO/098.pdf,pdf,19.1738,96.1342,,Barco,"Veracruz, México","Fotografía de un barco de vapor en Veracruz, México con la palabra ""recuerdo"" escrita sobre la postal",Colección de postales de Manuel Campero,Es
099,Fotografía a color del puente internacional Santa Fe en Ciudad Juárez,099.pdf,ARCHIVO/099.pdf,pdf,31.6904,106.4245,,Ciudad,"Ciudad Juárez, México","Fotografía a color del puente internacional Santa Fe en Ciudad Juárez, México",Colección de postales de Manuel Campero,Es
100,"Fotografía a color de los edificios en la Plaza Beethoven, Ciudad de México",100.pdf,ARCHIVO/100.pdf,pdf,20.6689,-103.42368,,Ciudad,"Ciudad de México, México","Fotografía a color de los edificios en la Plaza Beethoven, Ciudad de México",Colección de postales de Manuel Campero,Es